{
  "affected_contracts": [],
  "affected_repos": [
    "mereka-lms"
  ],
  "canonical_inputs": [
    "docs/meta/knowledge/DECISION_RUNTIME_MODEL.md",
    "generated/knowledge/evidence-obligations.json",
    "generated/knowledge/read-first-packs.json",
    "generated/knowledge/review-decision.json",
    "generated/knowledge/reviewer-obligations.json",
    "generated/skills/runtime-convergence-report.json"
  ],
  "diff_range": "origin/main...HEAD",
  "generated_by": "tools/knowledge/build_release_readiness.py",
  "missing_evidence": [
    "catalog_governance",
    "docs_policy"
  ],
  "missing_reviewer_inputs": [
    "live reviewer approvals are unresolved input"
  ],
  "pack_id": "release-readiness",
  "promotion_contract_implications": [],
  "release_status": "ready",
  "rollback_obligations": [],
  "runtime_convergence_implications": [
    "Assistant/runtime front doors remain subordinate to canonical contract surfaces"
  ],
  "schema_version": 1,
  "source_range": "origin/main...HEAD",
  "why": [
    "review severity is medium",
    "runtime convergence state is warning",
    "required reviewer groups: docs, governance",
    "required evidence obligations: 2",
    "read-first priority packs: pack-registry, read-first"
  ]
}
